date_aaaammjj;menutypeplat;plat;specificites;repas
2021-03-29;Fromage;YAOURT FERMIER HQA ET SUCRE;Haute Qualité Alimentaire;DEJEUNER
2021-05-10;Fromage;FROMAGE GOUDA BIO IND;Produit Agriculture Biologique;DEJEUNER
2021-03-29;Dessert;BROWNIES UPC CREME ANGLAISE;;DEJEUNER
2021-05-11;Fromage;FROMAGE EDAM BIO IND;Produit Agriculture Biologique;DEJEUNER
2021-04-01;Entrée;SALADE MELANGE LOCALE BIO;Produit Agriculture Biologique;DEJEUNER
2021-05-11;Dessert;POMME PINK LADY HQA;Haute Qualité Alimentaire;DEJEUNER
2021-04-01;Dessert;CREME DESSERT CHOCOLAT BIO;Produit Agriculture Biologique;DEJEUNER
2021-05-17;Entrée;JAMBON CUIT / CORNICHON;;DEJEUNER
2021-04-02;Légumes;POMME DE TERRE ALLUMETTE FRITE;;DEJEUNER
2021-05-17;Entrée;POMELOS BIO AU SUCRE (ENTREE);Produit Agriculture Biologique;DEJEUNER
2021-04-02;Fromage;FROMAGE CAMEMBERT BIO;Produit Agriculture Biologique;DEJEUNER
2021-05-17;Plat;RAVIOLI ET FROMAGE RAPE - PLAT COMPLET;;DEJEUNER
2021-04-02;Dessert;DESSERT FRUIT Po DE SAISON BIO ANNUEL 2;Produit Agriculture Biologique;DEJEUNER
2021-05-17;Fromage;FROMAGE CARRE FRAIS BIO IND;Produit Agriculture Biologique;DEJEUNER
2021-04-06;Entrée;TIELLE DE SETE IND;;DEJEUNER
2021-05-18;Plat;POISSON PAVE BORDELAISE;;DEJEUNER
2021-04-06;Plat;MACARONADE SETOISE A/PORC GARNITURE;;DEJEUNER
2021-05-18;Légumes;POELEE D'HARICOTS BLANCS/LARDONS A LA GRAISSE D'OIE;;DEJEUNER
2021-04-06;Fromage;FROMAGE SALAGOU TOMETTE BREBIS;Haute Qualité Alimentaire;DEJEUNER
2021-05-18;Fromage;FROMAGE SAINT PAULIN BIO;Produit Agriculture Biologique;DEJEUNER
2021-04-08;Fromage;YAOURT FERMIER HQA ET SUCRE;Haute Qualité Alimentaire;DEJEUNER
2021-05-20;Plat;FALAFELS ET SES CEREALES SAUCE BLANCHE - COMPLET ALTERNATIF PV;Produit Agriculture Biologique;DEJEUNER
2021-04-08;Dessert;DESSERT FRUIT Po DE SAISON BIO ANNUEL 1;Produit Agriculture Biologique;DEJEUNER
2021-05-21;Plat;STEAK HACHE DE BOEUF FACON BOUCHERE;;DEJEUNER
2021-04-09;Plat;RISOTTO D'ORGE ET LENTILLES PLAT COMPLET COMPLET ALTERNATIF PA;;DEJEUNER
2021-05-25;Plat;ASSIETTE ORIENTALE ET SA SEMOULE BIO - COMPLET ALTERNATIF PV;;DEJEUNER
2021-04-12;Dessert;DESSERT FRUIT Po DE SAISON BIO ANNUEL 2;Produit Agriculture Biologique;DEJEUNER
2021-05-28;Entrée;JAMBON CRU SALVETAT/CORNICHON A/PORC;Haute Qualité Alimentaire;DEJEUNER
2021-04-13;Entrée;SALADE BIO AUX OLIVES NOIRES;Produit Agriculture Biologique;DEJEUNER
2021-05-28;Entrée;MELON PAYS;Haute Qualité Alimentaire;DEJEUNER
2021-04-15;Entrée;CAROTTES RAPEES BIO;Produit Agriculture Biologique;DEJEUNER
2021-05-28;Entrée;SALADE NICOISE UPC;;DEJEUNER
2021-04-15;Légumes;PUREE DE POMME DE TERRE UPC;;DEJEUNER
2021-05-28;Plat;HAUT DE CUISSE/PILONS DE POULET ROTI BIO;Produit Agriculture Biologique;DEJEUNER
2021-04-15;Dessert;LIEGEOIS BIO SAVEUR CHOCOLAT IND;Produit Agriculture Biologique;DEJEUNER
2021-05-28;Plat;TORTELLINI RICOTTA/EPINARD A LA CREME - COMPLET ALTERNATIF PA;;DEJEUNER
2021-04-16;Plat;FALAFELS ET SES CRUDITES PLAT COMPLET ALTERNATIF PV;;DEJEUNER
2021-05-28;Dessert;GLACE CONE CHOCOLAT;;DEJEUNER
2021-04-16;Légumes;TAGLIATELLE BIO AU BEURRE ET FROMAGE;Produit Agriculture Biologique;DEJEUNER
2021-05-31;Entrée;AVOCAT VINAIGRETTE;;DEJEUNER
2021-04-16;Fromage;FROMAGE PIK ET CROQ IND;;DEJEUNER
2021-05-31;Entrée;MELON JAUNE;;DEJEUNER
2021-04-16;Dessert;POIRE WILLIAMS BIO AU MIEL ET AMANDES GRILLEES;Produit Agriculture Biologique;DEJEUNER
2021-05-31;Légumes;AUBERGINES A LA GRECQUE;;DEJEUNER
2021-05-04;Entrée;SALADE LAITUE FEUILLE BIO AU BLEU;Produit Agriculture Biologique;DEJEUNER
2021-05-31;Fromage;FROMAGE BLANC NATURE BIO;Produit Agriculture Biologique;DEJEUNER
2021-05-04;Dessert;GLACE BATONNET VANILLE;;DEJEUNER
2021-05-31;Fromage;FROMAGE OSSAU IRATY A LA COUPE;Haute Qualité Alimentaire;DEJEUNER
2021-05-06;Entrée;TOMATE CERISE TAPENADE;;DEJEUNER
2021-06-01;Entrée;GASPACHO;;DEJEUNER
2021-05-06;Dessert;DESSERT FRUIT Po DE SAISON BIO ANNUEL 1;Produit Agriculture Biologique;DEJEUNER
2021-06-01;Entrée;OEUF A LA COQUE ET MOUILLETTE;;DEJEUNER
2021-05-07;Plat;DOS DE CABILLAUD MARINADE HUILE D'OLIVE CITRON;;DEJEUNER
2021-06-01;Fromage;PETITS SUISSE BIO AUX FRUITS;Produit Agriculture Biologique;DEJEUNER
2021-05-10;Entrée;TABOULE UPC;;DEJEUNER
2021-06-04;Entrée;CONCOMBRE TZATZIKI;;DEJEUNER
2021-05-10;Légumes;COURGETTE FRAICHE A L'AIL;Haute Qualité Alimentaire;DEJEUNER
2021-06-04;Plat;ROTI DE BOEUF AU JUS;Haute Qualité Alimentaire;DEJEUNER
2021-05-11;Entrée;MAIS AU THON;;DEJEUNER
2021-06-04;Légumes;POMMES VAPEUR PERSILLEES;;DEJEUNER
2021-05-11;Entrée;TOMATE FRAICHE AUX ANCHOIS;Haute Qualité Alimentaire;DEJEUNER
2021-06-04;Fromage;YAOURT NATURE BIO LAIT ENTIER ET SUCRE;Produit Agriculture Biologique;DEJEUNER
2021-05-11;Plat;BOLOGNAISE DE LENTILLES PLAT COMPLET ALTERNATIF PV;;DEJEUNER
2021-06-07;Légumes;POELEE D'ETE;;DEJEUNER
2021-05-11;Fromage;PETIT SUISSE NATURE BIO 60GR ET SUCRE;Produit Agriculture Biologique;DEJEUNER
2021-06-07;Fromage;FROMAGE GOUDA BIO IND;Produit Agriculture Biologique;DEJEUNER
2021-05-17;Dessert;GLACE BARRE SNICKERS;;DEJEUNER
2021-06-08;Légumes;POMME DE TERRE FRITE FRAICHE;;DEJEUNER
2021-05-20;Dessert;DESSERT FRUIT Po DE SAISON BIO ANNUEL 1;Produit Agriculture Biologique;DEJEUNER
2021-06-08;Dessert;ABRICOT PAYS;Haute Qualité Alimentaire;DEJEUNER
2021-05-21;Entrée;SALADE DE PENNE BIO AUX CREVETTES;Produit Agriculture Biologique;DEJEUNER
2021-06-10;Entrée;SALADE PIEMONTAISE UPC;;DEJEUNER
2021-05-21;Dessert;CERISE DE PAYS;Haute Qualité Alimentaire;DEJEUNER
2021-06-10;Légumes;TOMATE CERISE ROTI;;DEJEUNER
2021-05-21;Dessert;GATEAU COCO UPC;;DEJEUNER
2021-06-10;Fromage;FROMAGE CARRE FRAIS BIO IND;Produit Agriculture Biologique;DEJEUNER
2021-05-25;Entrée;MELON JAUNE;;DEJEUNER
2021-06-10;Dessert;DESSERT FRUIT ETE BIO Po;Produit Agriculture Biologique;DEJEUNER
2021-05-25;Légumes;PETIT POIS TRES FINS CAROTTES BIO;Produit Agriculture Biologique;DEJEUNER
2021-06-10;Dessert;FRAISES DE PAYS AU SUCRE;Haute Qualité Alimentaire;DEJEUNER
2021-05-27;Plat;SAUTE DE DINDE BIO MARENGO;Produit Agriculture Biologique;DEJEUNER
2021-06-11;Plat;FALAFELS ET SES CRUDITES PLAT COMPLET ALTERNATIF PV;;DEJEUNER
2021-05-27;Légumes;POMME DE TERRE ROSTI;;DEJEUNER
2021-06-11;Dessert;CREME DESSERT CHOCOLAT BIO;Produit Agriculture Biologique;DEJEUNER
2021-05-27;Fromage;YAOURT CITRON BIO;Produit Agriculture Biologique;DEJEUNER
2021-06-14;Dessert;DESSERT FRUIT Po DE SAISON BIO ANNUEL 1;Produit Agriculture Biologique;DEJEUNER
2021-05-31;Légumes;COURGETTE FRAICHE A L'AIL;Haute Qualité Alimentaire;DEJEUNER
2021-06-15;Entrée;SAUCISSON ROSETTE SALVETAT ET BEURRE A/PORC;;DEJEUNER
2021-05-31;Dessert;GATEAU DE SEMOULE IND;;DEJEUNER
2021-06-15;Dessert;GLACE CONE VANILLE;;DEJEUNER
2021-06-01;Légumes;PATE MACARONIS BIO AU BEURRE;Produit Agriculture Biologique;DEJEUNER
2021-06-17;Entrée;ACCRAS DE MORUE ET CITRON;;DEJEUNER
2021-06-01;Fromage;FROMAGE BUCHE DU SALAGOU;Haute Qualité Alimentaire;DEJEUNER
2021-06-17;Entrée;CONCOMBRE TZATZIKI;;DEJEUNER
2021-06-04;Entrée;TOMATE CERISE TAPENADE;;DEJEUNER
2021-06-17;Entrée;SALADE MELANGE BIO AUX OIGNONS FRITS;Produit Agriculture Biologique;DEJEUNER
2021-06-07;Entrée;RADIS BEURRE;Haute Qualité Alimentaire;DEJEUNER
2021-06-17;Plat;TORTELLINIS 4 FROMAGES A LA CREME - COMPLET ALTERNATIF PA;;DEJEUNER
2021-06-07;Dessert;GLACE BARRE SNICKERS;;DEJEUNER
2021-06-18;Entrée;OEUF A LA COQUE ET MOUILLETTE;;DEJEUNER
2021-06-07;Dessert;GLACE BARRE TWIX;;DEJEUNER
2021-06-18;Plat;RISOTTO D'ORGE ET LENTILLES PLAT COMPLET COMPLET ALTERNATIF PA;;DEJEUNER
2021-06-08;Entrée;TOMATE DES DE BREBIS;Haute Qualité Alimentaire;DEJEUNER
2021-06-18;Fromage;FROMAGE BLANC NATURE BIO;Produit Agriculture Biologique;DEJEUNER
2021-06-08;Légumes;POMME DE TERRE ALLUMETTE FRITE;;DEJEUNER
2021-06-18;Dessert;COMPOTE DE POMME IND/BISCUIT PETIT BEURRE;;DEJEUNER
2021-06-08;Dessert;SALADE DE FRUIT FRAIS D'ETE;Haute Qualité Alimentaire;DEJEUNER
2021-06-21;Légumes;COURGETTE FRAICHE A L'AIL;Haute Qualité Alimentaire;DEJEUNER
2021-06-11;Entrée;SALADE NICOISE UPC;;DEJEUNER
2021-06-21;Dessert;RIZ AU LAIT ENTIER ET CARAMEL IND;;DEJEUNER
2021-06-11;Légumes;AUBERGINES A LA GRECQUE;;DEJEUNER
2021-06-24;Plat;OMELETTE NATURE;;DEJEUNER
2021-06-11;Fromage;YAOURT A BOIRE PANACHE;;DEJEUNER
2021-06-24;Légumes;PRINTANIERE DE LEGUMES;;DEJEUNER
2021-06-14;Entrée;GASPACHO;;DEJEUNER
2021-06-25;Entrée;JAMBON CRU SALVETAT/CORNICHON A/PORC;Haute Qualité Alimentaire;DEJEUNER
2021-06-14;Entrée;RADIS BEURRE;Haute Qualité Alimentaire;DEJEUNER
2021-06-25;Légumes;RIZ DE CAMARGUE PILAF;Haute Qualité Alimentaire;DEJEUNER
2021-06-14;Légumes;FLAN AUX CAROTTES BIO;Produit Agriculture Biologique;DEJEUNER
2021-06-28;Plat;FILET MEUNIERE ET CITRON;;DEJEUNER
2021-06-15;Plat;DOS DE COLIN SAUCE SETOISE;;DEJEUNER
2021-06-28;Plat;HAMBURGER DE BOEUF UPC;;DEJEUNER
2021-06-15;Légumes;HARICOTS VERTS BIO PERSILLES;Produit Agriculture Biologique;DEJEUNER
2021-06-29;Entrée;PIZZA FRAICHE AU FROMAGE MOZZARELLA;;DEJEUNER
2021-06-15;Fromage;FROMAGE EMMENTAL BIO IND;Produit Agriculture Biologique;DEJEUNER
2021-06-15;Dessert;GLACE CONE CHOCOLAT;;DEJEUNER
2021-06-17;Plat;MERGUEZ GRILLEE A LA SAUCE TOMATE;;DEJEUNER
2021-06-17;Fromage;FROMAGE CARRE FRAIS BIO IND;Produit Agriculture Biologique;DEJEUNER
2021-06-17;Fromage;YAOURT FRAISE AU LAIT ENTIER BIO IND;Produit Agriculture Biologique;DEJEUNER
2021-06-17;Dessert;DESSERT FRUIT Po DE SAISON BIO ANNUEL 1;Produit Agriculture Biologique;DEJEUNER
2021-06-21;Fromage;FROMAGE CAMEMBERT BIO;Produit Agriculture Biologique;DEJEUNER
2021-06-22;Plat;DOS DE COLIN SAUCE COCKTAIL;;DEJEUNER
2021-06-22;Légumes;BLE BIO AU BEURRE;Produit Agriculture Biologique;DEJEUNER
2021-06-25;Plat;ROUGAIL SAUCISSE A/PORC;Haute Qualité Alimentaire;DEJEUNER
2021-06-25;Plat;STEAK HACHE DE BOEUF FACON BOUCHERE;;DEJEUNER
2021-06-25;Dessert;GLACE SUNDAE VANILLE/FRAISE;;DEJEUNER
2021-06-28;Entrée;MELON PAYS AU JAMBON;;DEJEUNER
2021-06-29;Plat;NUGGETS DE FILET DE POULET;;DEJEUNER
2021-06-29;Légumes;POMME DE TERRE CHIPS;;DEJEUNER
2020-09-01;Légumes;PENNES BIO A LA SICILIENNE;Produit Agriculture Biologique;DEJEUNER
2020-09-03;Entrée;MELON JAUNE;;DEJEUNER
2020-09-03;Plat;POISSON PAVE BORDELAISE;;DEJEUNER
2020-09-03;Légumes;CAROTTES FRAICHES SAUTEES UPC;Haute Qualité Alimentaire;DEJEUNER
2020-09-03;Fromage;FROMAGE MINI BABYBEL IND;;DEJEUNER
2020-09-03;Dessert;PRUNE;;DEJEUNER
2020-09-04;Entrée;PASTEQUE;;DEJEUNER
2020-09-04;Légumes;BLE BIO AU BEURRE;Produit Agriculture Biologique;DEJEUNER
2020-09-04;Dessert;GLACE CONE VANILLE;;DEJEUNER
2020-09-07;Entrée;TOMATE FRAICHE VINAIGRETTE;Haute Qualité Alimentaire;DEJEUNER
2020-09-07;Plat;BLANQUETTE DE VEAU A L'ANCIENNE BIO;Produit Agriculture Biologique;DEJEUNER
2020-09-08;Dessert;DESSERT FRUIT ETE BIO Po;Produit Agriculture Biologique;DEJEUNER
2020-09-08;Dessert;DESSERT FRUIT Po DE SAISON BIO ANNUEL 1;Produit Agriculture Biologique;DEJEUNER
2020-09-10;Plat;NAVARIN DE MOUTON PRINTANIER;Haute Qualité Alimentaire;DEJEUNER
2020-09-10;Fromage;FROMAGE EMMENTAL BIO A LA COUPE;Produit Agriculture Biologique;DEJEUNER
2020-09-11;Plat;SPAGHETTI A LA BOLOGNAISE - COMPLET;;DEJEUNER
2020-09-11;Fromage;FROMAGE GOUDA BIO IND;Produit Agriculture Biologique;DEJEUNER
2020-09-14;Entrée;BEIGNET DE CALAMARS ET CITRON;;DEJEUNER
2020-09-14;Plat;DOS DE COLIN SAUCE CURRY;;DEJEUNER
2020-09-17;Dessert;SALADE DE FRUIT FRAIS D'ETE;Haute Qualité Alimentaire;DEJEUNER
2020-09-18;Plat;LASAGNES AU THON UPC (COLLEGIEN);;DEJEUNER
2020-09-21;Entrée;BETTERAVE BIO MIMOSA;Produit Agriculture Biologique;DEJEUNER
2020-09-21;Entrée;CONCOMBRE FRAIS VINAIGRETTE;Haute Qualité Alimentaire;DEJEUNER
2020-09-21;Plat;BRANDADE PARMENTIERE MORUE UPC - COMPLET;;DEJEUNER
2020-09-21;Fromage;YAOURT NATURE BIO LAIT ENTIER ET SUCRE;Produit Agriculture Biologique;DEJEUNER
2020-09-22;Entrée;CAROTTES RAPEES BIO;Produit Agriculture Biologique;DEJEUNER
2020-09-22;Légumes;HARICOTS VERTS BIO PERSILLES;Produit Agriculture Biologique;DEJEUNER
2020-09-24;Entrée;GASPACHO;;DEJEUNER
2020-09-24;Dessert;CREME DESSERT CHOCOLAT BIO;Produit Agriculture Biologique;DEJEUNER
2020-09-24;Dessert;FLAN BIO VANILLE/CARAMEL LES 2 VACHES;Produit Agriculture Biologique;DEJEUNER
2020-09-25;Fromage;YAOURT GERVAIS MAXI IND;;DEJEUNER
2020-09-28;Entrée;TABOULE QUINOA BIO ET DES DE BREBIS;Produit Agriculture Biologique;DEJEUNER
2020-09-28;Plat;SAUCISSE DE TOULOUSE A GRILLER A/PORC;Haute Qualité Alimentaire;DEJEUNER
2020-09-28;Dessert;GLACE CONE CHOCOLAT;;DEJEUNER
2020-09-29;Entrée;MELON PAYS;Haute Qualité Alimentaire;DEJEUNER
2020-10-01;Plat;FILET DE POULET BBC A GRILLER;;DEJEUNER
2020-10-02;Entrée;OEUF A LA COQUE ET MOUILLETTE;;DEJEUNER
2020-10-02;Plat;CURRY LEGUMES/RIZ DE CAMARGUE- PLAT COMPLET ALTERNATIF PV;Haute Qualité Alimentaire;DEJEUNER
2020-10-02;Légumes;PUREE DE CAROTTES UPC;;DEJEUNER
2020-10-05;Fromage;FROMAGE EMMENTAL BIO IND;Produit Agriculture Biologique;DEJEUNER
2020-10-05;Dessert;GLACE BARRE SNICKERS;;DEJEUNER
2020-10-06;Entrée;CAROTTES RAPEES BIO SAUCE VINAIGRETTE;Produit Agriculture Biologique;DEJEUNER
2020-10-06;Entrée;TOMATE CERISE TAPENADE;;DEJEUNER
2020-10-08;Entrée;TOMATE FRAICHE AUX ANCHOIS;Haute Qualité Alimentaire;DEJEUNER
2020-10-08;Dessert;GATEAU FACON D'AIGUES MORTES MAISON;;DEJEUNER
2020-10-12;Plat;TORTELLINIS 4 FROMAGES A LA CREME - COMPLET ALTERNATIF PA;;DEJEUNER
2020-10-12;Dessert;BEIGNET CHOCOLAT;;DEJEUNER
2020-10-13;Entrée;SALADE MACHE AU LEERDAMER ZIG ZAG;Haute Qualité Alimentaire;DEJEUNER
2020-10-13;Légumes;PUREE DE POTIRON;;DEJEUNER
2020-10-13;Dessert;DESSERT FRUIT Po DE SAISON BIO ANNUEL 2;Produit Agriculture Biologique;DEJEUNER
2020-10-15;Plat;ROUILLE A LA SETOISE;;DEJEUNER
2020-10-16;Plat;STEAK HACHE DE BOEUF FACON BOUCHERE;;DEJEUNER
2020-10-16;Légumes;PETIT POIS CAROTTES BIO UPC;Produit Agriculture Biologique;DEJEUNER
2020-10-16;Légumes;POELEE RATATOUILLE GNOCCHI;;DEJEUNER
2020-10-16;Dessert;MOUSSE AU CHOCOLAT AU LAIT IND;;DEJEUNER
2020-11-03;Fromage;YAOURT A BOIRE PANACHE;;DEJEUNER
2020-11-03;Dessert;DESSERT FRUIT Po DE SAISON BIO ANNUEL 2;Produit Agriculture Biologique;DEJEUNER
2020-11-05;Entrée;SALADE MELANGE LOCALE BIO AUX CROUTONS;Produit Agriculture Biologique;DEJEUNER
2020-11-05;Entrée;TAPENADE LEGUMES HIVER UPC;Haute Qualité Alimentaire;DEJEUNER
2020-11-05;Légumes;CAROTTES FRAICHES SAUTEES UPC;Haute Qualité Alimentaire;DEJEUNER
2020-11-05;Fromage;FROMAGE CARRE FRAIS BIO IND;Produit Agriculture Biologique;DEJEUNER
2020-11-05;Fromage;YAOURT NATURE BIO LES 2 VACHES ET SUCRE;Produit Agriculture Biologique;DEJEUNER
2020-11-06;Plat;ESCALOPE POULET BBC A GRILLER SAUCE FORESTIERE;;DEJEUNER
2020-11-09;Entrée;SALADE D'ENDIVES AUX NOIX;;DEJEUNER
2020-11-09;Entrée;SOUPE DE LEGUMES UPC;Haute Qualité Alimentaire;DEJEUNER
2020-11-09;Plat;FAJITAS VEGE - PLAT COMPLET ALTERNATIF PV;;DEJEUNER
2020-11-09;Légumes;BROCOLI BIO EN GRATIN;Produit Agriculture Biologique;DEJEUNER
2020-11-09;Fromage;FROMAGE CAMEMBERT BIO;Produit Agriculture Biologique;DEJEUNER
2020-11-09;Dessert;CREME DESSERT CHOCOLAT BIO;Produit Agriculture Biologique;DEJEUNER
2020-11-09;Dessert;PETITS SUISSE BIO AUX FRUITS;Produit Agriculture Biologique;DEJEUNER
2020-11-10;Plat;DINDE SAUTE BIO AU CURRY;Produit Agriculture Biologique;DEJEUNER
2020-11-10;Fromage;YAOURT NATURE BIO LAIT ENTIER ET SUCRE;Produit Agriculture Biologique;DEJEUNER
2020-11-10;Dessert;DESSERT FRUIT Po DE SAISON BIO ANNUEL 2;Produit Agriculture Biologique;DEJEUNER
2020-11-12;Légumes;POMME DE TERRE ALLUMETTE FRITE;;DEJEUNER
2020-11-13;Entrée;BEIGNET DE CALAMARS ET CITRON;;DEJEUNER
2020-11-13;Entrée;GASPACHO;;DEJEUNER
2020-11-13;Plat;PAELLA AU POULET - PLAT COMPLET;;DEJEUNER
2020-11-13;Dessert;DESSERT FRUIT Po DE SAISON BIO ANNUEL 2;Produit Agriculture Biologique;DEJEUNER
2020-11-13;Dessert;FLAN BIO VANILLE/CARAMEL LES 2 VACHES;Produit Agriculture Biologique;DEJEUNER
2020-11-16;Entrée;SALADE D'ENDIVES AU LEERDAMER ZIG ZAG;;DEJEUNER
2020-11-16;Plat;OMELETTE/GALETTE PDT SUR TOASTINETTE - COMPLET ALTERNATIF PA;;DEJEUNER
2020-11-17;Dessert;SALADE FRUITS D'HIVER FRAIS;Haute Qualité Alimentaire;DEJEUNER
2020-11-19;Plat;SAUCISSE DE TOULOUSE A GRILLER A/PORC;Haute Qualité Alimentaire;DEJEUNER
2020-11-19;Légumes;FLAN AUX BROCOLIS BIO;Produit Agriculture Biologique;DEJEUNER
2020-11-19;Dessert;DESSERT FRUIT Po DE SAISON BIO ANNUEL 1;Produit Agriculture Biologique;DEJEUNER
2020-11-23;Entrée;SALADE DE CHOUX FLEURS BIO;Produit Agriculture Biologique;DEJEUNER
2020-11-23;Plat;DOS DE CABILLAUD AU BEURRE BLANC;;DEJEUNER
2020-11-23;Légumes;BLE BIO AU BEURRE;Produit Agriculture Biologique;DEJEUNER
2020-11-23;Légumes;FONDUE DE POIREAUX FRAIS;Haute Qualité Alimentaire;DEJEUNER
2020-11-23;Dessert;DESSERT FRUIT Po DE SAISON BIO ANNUEL 2;Produit Agriculture Biologique;DEJEUNER
2020-11-24;Entrée;CAROTTES RAPEES BIO;Produit Agriculture Biologique;DEJEUNER
2020-11-24;Entrée;VELOUTE DE COURGETTES A LA VACHE QUI RIT;Haute Qualité Alimentaire;DEJEUNER
2020-11-24;Fromage;FROMAGE SALAGOU TOMETTE DU CAYLAR;Haute Qualité Alimentaire;DEJEUNER
2020-11-24;Dessert;FLAN BIO VANILLE/CARAMEL LES 2 VACHES;Produit Agriculture Biologique;DEJEUNER
2020-11-26;Plat;FILET DE POULET SAUCE BARBECUE;;DEJEUNER
2020-11-27;Entrée;SALADE LAITUE FEUILLE BIO AU GESIERS;Produit Agriculture Biologique;DEJEUNER
2020-11-30;Fromage;YAOURT BIO SUCRE SAVEUR VANILLE;Produit Agriculture Biologique;DEJEUNER
2020-11-30;Dessert;TARTE NOIX DE COCO/ANANAS;;DEJEUNER
2020-12-01;Dessert;FLAN BIO VANILLE/CARAMEL LES 2 VACHES;Produit Agriculture Biologique;DEJEUNER
2020-12-03;Entrée;AVOCAT CITRON;;DEJEUNER
2020-12-03;Entrée;ENDIVES SAUCE BLEU CAJOU CREME;;DEJEUNER
2020-12-04;Entrée;TAPENADE LEGUMES HIVER UPC;Haute Qualité Alimentaire;DEJEUNER
2020-12-04;Fromage;YAOURT CITRON BIO;Produit Agriculture Biologique;DEJEUNER
2020-12-07;Entrée;POMELOS BIO AU SUCRE (ENTREE);Produit Agriculture Biologique;DEJEUNER
2020-12-08;Entrée;VELOUTE DE POTIRON MAISON;Haute Qualité Alimentaire;DEJEUNER
2020-12-08;Plat;POISSON PAVE BORDELAISE;;DEJEUNER
2020-12-08;Légumes;CAROTTES BIO A LA PAYSANNE UPC;Produit Agriculture Biologique;DEJEUNER
2020-12-08;Fromage;FROMAGE SALAGOU TOMETTE DU CAYLAR;Haute Qualité Alimentaire;DEJEUNER
2020-12-10;Plat;DOS DE CABILLAUD SAUCE VIERGE;;DEJEUNER
2020-12-10;Fromage;FROMAGE BLANC NATURE BIO;Produit Agriculture Biologique;DEJEUNER
2020-12-11;Entrée;CHOUX CHINOIS SAUCE BULGARE;;DEJEUNER
2020-12-11;Plat;DOS DE COLIN MARINADE HUILE D'OLIVE ET CITRON;;DEJEUNER
2020-12-11;Dessert;CREME DESSERT VANILLE BIO;Produit Agriculture Biologique;DEJEUNER
2020-12-14;Légumes;PETIT POIS CAROTTES BIO UPC;Produit Agriculture Biologique;DEJEUNER
2020-12-14;Fromage;YAOURT A BOIRE PANACHE;;DEJEUNER
2020-12-14;Dessert;DESSERT FRUIT Po DE SAISON BIO ANNUEL 2;Produit Agriculture Biologique;DEJEUNER
2020-12-15;Plat;BLANQUETTE DE VEAU A L'ANCIENNE BIO;Produit Agriculture Biologique;DEJEUNER
2020-12-17;Entrée;SALADE DE NOEL;;DEJEUNER
2020-12-17;Entrée;VELOUTE DE BUTTERNUT AUX ECLATS DE MARRONS ET DES DE ROQUEFORT;Haute Qualité Alimentaire;DEJEUNER
2020-12-17;Fromage;CLEMENTINE ET CHOCOLAT;;DEJEUNER
2020-12-17;Dessert;MINI CHOUX SAUCE CHOCOLAT ET CHANTILLY;;DEJEUNER
2020-12-18;Entrée;BEIGNET DE CALAMARS ET CITRON;;DEJEUNER
2020-12-18;Entrée;FILET DE MAQUEREAU ESCABECHE;;DEJEUNER
2020-12-18;Fromage;FROMAGE EMMENTAL BIO IND;Produit Agriculture Biologique;DEJEUNER
2020-12-18;Fromage;FROMAGE GOUDA BIO IND;Produit Agriculture Biologique;DEJEUNER
2021-01-04;Entrée;POMELOS BIO AU SUCRE (ENTREE);Produit Agriculture Biologique;DEJEUNER
2021-01-04;Plat;FILET MEUNIERE ET CITRON;;DEJEUNER
2021-01-04;Dessert;COMPOTE POMME/POIRE BIO/BISCUIT PETIT BEURRE;Produit Agriculture Biologique;DEJEUNER
2021-01-04;Dessert;POIRE WILLIAMS BIO AU MIEL ET AMANDES GRILLEES;Produit Agriculture Biologique;DEJEUNER
2021-01-07;Entrée;AVOCAT VINAIGRETTE;;DEJEUNER
2021-01-07;Entrée;SALADE MACHE AU LEERDAMER ZIG ZAG;Haute Qualité Alimentaire;DEJEUNER
2021-01-08;Légumes;HARICOTS VERTS BIO AU BEURRE PERSILLES;Produit Agriculture Biologique;DEJEUNER
2021-01-08;Fromage;YAOURT FERMIER HQA ET SUCRE;Haute Qualité Alimentaire;DEJEUNER
2021-01-08;Dessert;SALADE FRUITS D'HIVER FRAIS;Haute Qualité Alimentaire;DEJEUNER
2021-01-11;Entrée;SALADE DE CHOUX FLEURS BIO;Produit Agriculture Biologique;DEJEUNER
2021-01-11;Légumes;POELEE RATATOUILLE GNOCCHI;;DEJEUNER
2021-01-12;Entrée;AVOCAT MAYONNAISE;;DEJEUNER
2021-01-12;Entrée;OEUF A LA COQUE ET MOUILLETTE;;DEJEUNER
2021-01-12;Plat;GRATIN POMME DE TERRE REBLOCHON - PLAT COMPLET ALTERNATIF PA;;DEJEUNER
2021-01-12;Plat;STEAK HACHE DE BOEUF FACON BOUCHERE;;DEJEUNER
2021-01-12;Légumes;PUREE DE CAROTTES UPC;;DEJEUNER
2021-01-12;Fromage;FROMAGE CAMEMBERT BIO;Produit Agriculture Biologique;DEJEUNER
2021-01-12;Dessert;DESSERT FRUIT Po DE SAISON BIO ANNUEL 1;Produit Agriculture Biologique;DEJEUNER
2021-01-14;Entrée;SALADE DE MACHE AUX DES DE FOURME D'AMBERT;Haute Qualité Alimentaire;DEJEUNER
2021-01-15;Entrée;JAMBON CUIT / BEURRE;;DEJEUNER
2021-01-18;Entrée;SALADE DE MACHE HQA;Haute Qualité Alimentaire;DEJEUNER
2021-01-18;Plat;TORTELLINIS 4 FROMAGES A LA SAUCE TOMATE - COMPLET ALTERNATIF PA;;DEJEUNER
2021-01-19;Plat;OMELETTE NATURE;;DEJEUNER
2021-01-19;Dessert;PUREE POMME/FRAMBOISE IND;;DEJEUNER
2021-01-21;Plat;BOEUF BIO ESTOUFFADE PROVENCALE;Produit Agriculture Biologique;DEJEUNER
2021-01-21;Légumes;PUREE DE POMME DE TERRE UPC;;DEJEUNER
2021-01-22;Entrée;JAMBON CRU SALVETAT/CORNICHON A/PORC;Haute Qualité Alimentaire;DEJEUNER
2021-01-22;Fromage;FROMAGE GOUDA BIO IND;Produit Agriculture Biologique;DEJEUNER
2021-01-25;Fromage;FROMAGE BLANC NATURE BIO;Produit Agriculture Biologique;DEJEUNER
2021-01-26;Plat;BOLOGNAISE DE LENTILLES PLAT COMPLET ALTERNATIF PV;;DEJEUNER
2021-01-26;Plat;HAUT DE CUISSE/PILONS DE POULET ROTI BIO;Produit Agriculture Biologique;DEJEUNER
2021-01-28;Entrée;SALADE MELANGE LOCALE BIO AUX CROUTONS;Produit Agriculture Biologique;DEJEUNER
2021-01-28;Plat;DOS DE CABILLAUD A LA SAUCE CATALANE;;DEJEUNER
2021-01-28;Dessert;KIWI;;DEJEUNER
2021-01-29;Entrée;PATE CAMPAGNE HQA A/PORC;Haute Qualité Alimentaire;DEJEUNER
2021-01-29;Légumes;SEMOULE BIO A L'HUILE D'OLIVE;Produit Agriculture Biologique;DEJEUNER
2021-02-01;Légumes;BLE BIO AU BEURRE;Produit Agriculture Biologique;DEJEUNER
2021-02-01;Fromage;FROMAGE BREBIS CREME Po;;DEJEUNER
2021-02-02;Fromage;FROMAGE BLANC AU FRUIT;;DEJEUNER
2021-02-04;Dessert;SALADE FRUITS D'HIVER FRAIS;Haute Qualité Alimentaire;DEJEUNER
2021-02-05;Légumes;EPINARD BIO A LA CREME;Produit Agriculture Biologique;DEJEUNER
2021-02-05;Fromage;PETIT SUISSE NATURE 60GR ET SUCRE;;DEJEUNER
2021-02-05;Dessert;ANANAS FRAIS EN TRANCHE;Haute Qualité Alimentaire;DEJEUNER
2021-02-05;Dessert;COMPOTE BIO POMME ALLEGEE ET BISCUIT CIGARETTE;Produit Agriculture Biologique;DEJEUNER
2021-02-08;Plat;ESCALOPE DE PORC BIO A GRILLER AUX HERBES DE PROVENCE;Produit Agriculture Biologique;DEJEUNER
2021-02-08;Légumes;FONDUE DE POIREAUX FRAIS;Haute Qualité Alimentaire;DEJEUNER
2021-02-08;Fromage;YAOURT A BOIRE PANACHE;;DEJEUNER
2021-02-09;Entrée;DUO DE CHOUX VINAIGRETTE;Haute Qualité Alimentaire;DEJEUNER
2021-02-09;Entrée;SALADE D'ENDIVE AU BLEU ET NOIX;;DEJEUNER
2021-02-09;Fromage;YAOURT CITRON BIO;Produit Agriculture Biologique;DEJEUNER
2021-02-11;Plat;BOEUF BIO FACON GARDIANE;Produit Agriculture Biologique;DEJEUNER
2021-02-11;Légumes;RIZ DE CAMARGUE PILAF;Haute Qualité Alimentaire;DEJEUNER
2021-02-12;Entrée;FILET DE MAQUEREAU MOUTARDE;;DEJEUNER
2021-02-12;Plat;TORTELLINIS 4 FROMAGES A LA CREME - COMPLET ALTERNATIF PA;;DEJEUNER
2021-02-12;Dessert;CREME DESSERT CHOCOLAT BIO;Produit Agriculture Biologique;DEJEUNER
2021-03-04;Plat;DOS DE COLIN MARINADE HUILE D'OLIVE ET CITRON;;DEJEUNER
2021-03-04;Légumes;EPINARDS BIO A LA VACHE QUI RIT;Produit Agriculture Biologique;DEJEUNER
2021-03-04;Fromage;FROMAGE CAMEMBERT BIO;Produit Agriculture Biologique;DEJEUNER
2021-03-05;Plat;ASSIETTE ORIENTALE ET SA SEMOULE BIO - COMPLET ALTERNATIF PV;;DEJEUNER
2021-03-08;Dessert;DESSERT FRUIT Po DE SAISON BIO ANNUEL 1;Produit Agriculture Biologique;DEJEUNER
2021-03-08;Dessert;DESSERT FRUIT Po DE SAISON BIO ANNUEL 2;Produit Agriculture Biologique;DEJEUNER
2021-03-09;Plat;DORADE SEBASTE SAUCE CITRON VERT;;DEJEUNER
2021-03-09;Dessert;DESSERT FRUIT Po DE SAISON BIO ANNUEL 1;Produit Agriculture Biologique;DEJEUNER
2021-03-11;Légumes;CAROTTES RISOTTO (COLLEGIEN);Haute Qualité Alimentaire;DEJEUNER
2021-03-11;Fromage;YAOURT STRACCIATELLA;;DEJEUNER
2021-03-11;Dessert;TIRAMISU UPC;;DEJEUNER
2021-03-12;Légumes;FONDUE DE POIREAUX FRAIS;Haute Qualité Alimentaire;DEJEUNER
2021-03-12;Fromage;YAOURT CITRON BIO;Produit Agriculture Biologique;DEJEUNER
2021-03-15;Plat;POISSON PAVE BORDELAISE;;DEJEUNER
2021-03-15;Fromage;FROMAGE SAINT NECTAIRE AOP;Haute Qualité Alimentaire;DEJEUNER
2021-03-15;Fromage;YAOURT A BOIRE PANACHE;;DEJEUNER
2021-03-16;Entrée;CAKE AUX OLIVES. DES DE BREBIS ET SALADE MELANGE;Haute Qualité Alimentaire;DEJEUNER
2021-03-16;Plat;FALAFELS ET SES CEREALES SAUCE BLANCHE - COMPLET ALTERNATIF PV;Produit Agriculture Biologique;DEJEUNER
2021-03-16;Plat;HAUT DE CUISSE/PILONS DE POULET ROTI BIO;Produit Agriculture Biologique;DEJEUNER
2021-03-18;Plat;OMELETTE NATURE BIO;Produit Agriculture Biologique;DEJEUNER
2021-03-18;Plat;SAUTE DE BOEUF STROGONOF;Haute Qualité Alimentaire;DEJEUNER
2021-03-19;Légumes;RIZ PILAF;;DEJEUNER
2021-03-19;Fromage;YAOURT BIO SUCRE SAVEUR VANILLE;Produit Agriculture Biologique;DEJEUNER
2021-03-19;Dessert;DESSERT FRUIT Po DE SAISON BIO ANNUEL 1;Produit Agriculture Biologique;DEJEUNER
2021-03-19;Dessert;DESSERT FRUIT Po DE SAISON BIO ANNUEL 2;Produit Agriculture Biologique;DEJEUNER
2021-03-22;Plat;BOLOGNAISE DE LENTILLES PLAT COMPLET ALTERNATIF PV;;DEJEUNER
