date_aaaammjj;menutypeplat;plat;specificites;repas
2020-09-03;Entrée;SALADE LAITUE FEUILLE BIO A LA FETA;Produit Agriculture Biologique;DEJEUNER
2020-09-03;Plat;MERGUEZ A GRILLER A LA SAUCE TOMATE;;DEJEUNER
2020-09-04;Entrée;RADIS BEURRE;Haute Qualité Alimentaire;DEJEUNER
2020-09-04;Plat;FILET DE POULET A GRILLER CREME TANDOORI;;DEJEUNER
2020-09-07;Entrée;ROULE AU FROMAGE;;DEJEUNER
2020-09-07;Plat;TORTILLA (OMELETTE PDT ET LEGUMES) - PLAT COMPLET VEGETARIEN PA;;DEJEUNER
2020-09-07;Fromage;FROMAGE CANTAL IND;Haute Qualité Alimentaire;DEJEUNER
2020-09-07;Dessert;DESSERT FRUIT Po DE SAISON BIO ANNUEL 2;Produit Agriculture Biologique;DEJEUNER
2020-09-08;Légumes;POMME DE TERRE FRITE FRAICHE;;DEJEUNER
2020-09-08;Fromage;FROMAGE ROUY;;DEJEUNER
2020-09-10;Plat;PILON DE POULET CUIT AUX HERBES;;DEJEUNER
2020-09-11;Entrée;AVOCAT VINAIGRETTE;;DEJEUNER
2020-09-11;Dessert;COMPOTE POMME FRAICHE UPC;Haute Qualité Alimentaire;DEJEUNER
2020-09-15;Légumes;AUBERGINE PROVENCAL;;DEJEUNER
2020-09-15;Fromage;FROMAGE CARRE FRAIS BIO IND;Produit Agriculture Biologique;DEJEUNER
2020-09-15;Fromage;YAOURT BIO FRAISE;Produit Agriculture Biologique;DEJEUNER
2020-09-17;Plat;TORTELLINI RICOTTA/EPINARD A LA CREME - COMPLET ALTERNATIF PA;;DEJEUNER
2020-09-18;Plat;FILET MEUNIERE ET CITRON;;DEJEUNER
2020-09-18;Fromage;FROMAGE EDAM BIO IND;Produit Agriculture Biologique;DEJEUNER
2020-09-18;Dessert;CREME DESSERT VANILLE BIO;Produit Agriculture Biologique;DEJEUNER
2020-09-18;Dessert;POIRE WILLIAMS BIO SAUCE CHOCOLAT;Produit Agriculture Biologique;DEJEUNER
2020-09-21;Entrée;HOUMOUS ET BATONNET CAROTTE UPC;Haute Qualité Alimentaire;DEJEUNER
2020-09-21;Plat;ASSIETTE ORIENTALE ET SA SEMOULE BIO - COMPLET ALTERNATIF PV;;DEJEUNER
2020-09-21;Dessert;DESSERT FRUIT Po DE SAISON BIO ANNUEL 2;Produit Agriculture Biologique;DEJEUNER
2020-09-22;Entrée;SARDINE A L'HUILE ET CITRON FRAIS;;DEJEUNER
2020-09-22;Entrée;TOMATE FRAICHE AU THON;Haute Qualité Alimentaire;DEJEUNER
2020-09-22;Plat;CHIPOLATA A GRILLER A LA SAUCE TOMATE A/PORC;Haute Qualité Alimentaire;DEJEUNER
2020-09-22;Légumes;PUREE MOUSSELINE UPC;;DEJEUNER
2020-09-22;Dessert;GAUFRE SAUCE CHOCOLAT;;DEJEUNER
2020-09-24;Entrée;SALADE LAITUE BIO AUX DES D'EMMENTAL;Produit Agriculture Biologique;DEJEUNER
2020-09-24;Fromage;FROMAGE CANTAL AOP;Haute Qualité Alimentaire;DEJEUNER
2020-09-24;Fromage;FROMAGE SAINT PAULIN BIO;Produit Agriculture Biologique;DEJEUNER
2020-09-25;Entrée;TOMATE CERISE TAPENADE;;DEJEUNER
2020-09-25;Fromage;PETIT SUISSE NATURE BIO 60GR ET SUCRE;Produit Agriculture Biologique;DEJEUNER
2020-09-29;Plat;FILET DE DORADE SAUCE CATALANE;;DEJEUNER
2020-09-29;Fromage;FROMAGE KIRI CREME IND;;DEJEUNER
2020-09-29;Dessert;DESSERT FRUIT Po DE SAISON BIO ANNUEL 2;Produit Agriculture Biologique;DEJEUNER
2020-10-01;Entrée;SALADE DE TAGLIATELLES BIO AUX CREVETTES;Produit Agriculture Biologique;DEJEUNER
2020-10-01;Légumes;GRATIN DAUPHINOIS UPC;;DEJEUNER
2020-10-02;Entrée;SALADE MELANGE LOCALE BIO BILLES MOZZARELLA;Produit Agriculture Biologique;DEJEUNER
2020-10-02;Entrée;TOMATE FRAICHE VINAIGRETTE;Haute Qualité Alimentaire;DEJEUNER
2020-10-05;Entrée;AVOCAT VINAIGRETTE;;DEJEUNER
2020-10-05;Légumes;BROCOLI BIO EN GRATIN;Produit Agriculture Biologique;DEJEUNER
2020-10-05;Dessert;IRISH LEMON CAKE - UPC;;DEJEUNER
2020-10-06;Plat;OMELETTE/GALETTE PDT SUR TOASTINETTE - COMPLET ALTERNATIF PA;;DEJEUNER
2020-10-06;Plat;SPAGHETTIS CARBONARA PLAT COMPLET;;DEJEUNER
2020-10-08;Entrée;JAMBON CRU SALVETAT/CORNICHON A/PORC;Haute Qualité Alimentaire;DEJEUNER
2020-10-08;Plat;MACARONADE SETOISE A/PORC GARNITURE;;DEJEUNER
2020-10-08;Fromage;FROMAGE SALAGOU TOMETTE DU CAYLAR;Haute Qualité Alimentaire;DEJEUNER
2020-10-09;Entrée;PIZZA AU FROMAGE EN BANDE;;DEJEUNER
2020-10-09;Entrée;SALADE MELANGE BIO AUX DES DE TOMATE;Produit Agriculture Biologique;DEJEUNER
2020-10-09;Légumes;CAROTTE FRAICHE BEURRE PERSILLEE;Haute Qualité Alimentaire;DEJEUNER
2020-10-09;Dessert;CREME DESSERT VANILLE PETIT POT;;DEJEUNER
2020-10-12;Entrée;CHOU FLEUR FLEURETTE CRU SAUCE COCKTAIL;;DEJEUNER
2020-10-12;Plat;DOS DE COLIN SAUCE CATALANE;;DEJEUNER
2020-10-12;Légumes;HARICOTS VERTS BIO AU BEURRE PERSILLES;Produit Agriculture Biologique;DEJEUNER
2020-10-12;Fromage;FROMAGE BLANC NATURE BIO;Produit Agriculture Biologique;DEJEUNER
2020-10-13;Plat;ROUGAIL SAUCISSE A/PORC;Haute Qualité Alimentaire;DEJEUNER
2020-10-15;Plat;OMELETTE NATURE BIO;Produit Agriculture Biologique;DEJEUNER
2020-10-15;Dessert;SALADE FRUITS D'HIVER FRAIS;Haute Qualité Alimentaire;DEJEUNER
2020-10-16;Entrée;OEUF A LA COQUE ET MOUILLETTE;;DEJEUNER
2020-10-16;Dessert;LIEGEOIS VANILLE / CARAMEL;;DEJEUNER
2020-11-02;Entrée;CAROTTES RAPEES AU CITRON;;DEJEUNER
2020-11-02;Plat;POISSON PAVE BORDELAISE;;DEJEUNER
2020-11-03;Entrée;PATE CAMPAGNE HQA A/PORC;Haute Qualité Alimentaire;DEJEUNER
2020-11-03;Légumes;PRINTANIERE DE LEGUMES;;DEJEUNER
2020-11-03;Fromage;FROMAGE CANTAL AOP;Haute Qualité Alimentaire;DEJEUNER
2020-11-05;Plat;CURRY LEGUMES/RIZ DE CAMARGUE- PLAT COMPLET ALTERNATIF PV;Haute Qualité Alimentaire;DEJEUNER
2020-11-05;Plat;SAUTE DE PORC BIO EN CIVET;Produit Agriculture Biologique;DEJEUNER
2020-11-06;Plat;DOS DE CABILLAUD A LA SAUCE CATALANE;;DEJEUNER
2020-11-09;Plat;DOS DE COLIN MARINADE HUILE D'OLIVE ET CITRON;;DEJEUNER
2020-11-10;Plat;SAUCISSE AUX HERBES A GRILLER A/PORC HQA;Haute Qualité Alimentaire;DEJEUNER
2020-11-10;Dessert;COMPOTE BIO POMME ALLEGEE ET BISCUIT CIGARETTE;Produit Agriculture Biologique;DEJEUNER
2020-11-12;Entrée;SALADE MELANGE LOCALE BIO AUX CROUTONS;Produit Agriculture Biologique;DEJEUNER
2020-11-12;Dessert;DANETTE VANILLE IND;;DEJEUNER
2020-11-12;Dessert;RIZ AU LAIT ENTIER ET CARAMEL IND;;DEJEUNER
2020-11-13;Entrée;CHORIZO DOUX A/PORC;;DEJEUNER
2020-11-13;Fromage;FROMAGE TOMME CATALANE AOP;Haute Qualité Alimentaire;DEJEUNER
2020-11-16;Entrée;PAMPLEMOUSSE ROSE AU SUCRE (ENTREE);;DEJEUNER
2020-11-16;Légumes;HARICOTS VERTS BIO PARMENTIER;Produit Agriculture Biologique;DEJEUNER
2020-11-16;Fromage;FROMAGE PETIT LOUIS COQUE IND;;DEJEUNER
2020-11-17;Entrée;OEUF DUR MIMOSA;;DEJEUNER
2020-11-17;Légumes;PETIT POIS CAROTTES BIO UPC;Produit Agriculture Biologique;DEJEUNER
2020-11-19;Fromage;FROMAGE CARRE FRAIS BIO IND;Produit Agriculture Biologique;DEJEUNER
2020-11-19;Dessert;DESSERT FRUIT Po DE SAISON BIO ANNUEL 2;Produit Agriculture Biologique;DEJEUNER
2020-11-23;Entrée;TIELLE DE SETE IND;;DEJEUNER
2020-11-23;Fromage;YAOURT NATURE BIO LES 2 VACHES ET SUCRE;Produit Agriculture Biologique;DEJEUNER
2020-11-23;Dessert;DESSERT FRUIT Po DE SAISON BIO ANNUEL 1;Produit Agriculture Biologique;DEJEUNER
2020-11-24;Dessert;RIZ AU LAIT ENTIER ET CARAMEL IND;;DEJEUNER
2020-11-26;Légumes;HARICOTS VERTS BIO CAROTTES;Produit Agriculture Biologique;DEJEUNER
2020-11-27;Fromage;FROMAGE TOMME DE BREBIS;;DEJEUNER
2020-11-27;Dessert;DESSERT FRUIT Po DE SAISON BIO ANNUEL 1;Produit Agriculture Biologique;DEJEUNER
2020-11-30;Entrée;SOUPE DE NOUILLE AUX CREVETTES UPC;;DEJEUNER
2020-11-30;Légumes;RIZ CANTONNAIS;;DEJEUNER
2020-11-30;Dessert;ANANAS FRAIS EN TRANCHE;Haute Qualité Alimentaire;DEJEUNER
2020-12-01;Entrée;LENTILLES VINAIGRETTE;;DEJEUNER
2020-12-01;Entrée;VELOUTE CAROTTES BIO MAISON;Produit Agriculture Biologique;DEJEUNER
2020-12-01;Légumes;CHOU FLEUR BIO EN GRATIN;Produit Agriculture Biologique;DEJEUNER
2020-12-04;Légumes;FONDUE DE POIREAUX FRAIS;Haute Qualité Alimentaire;DEJEUNER
2020-12-07;Entrée;SAUCISSON SEC SALVETAT ET CORNICHONS;Haute Qualité Alimentaire;DEJEUNER
2020-12-10;Plat;ROUGAIL SAUCISSE A/PORC;Haute Qualité Alimentaire;DEJEUNER
2020-12-10;Légumes;PUREE DE BUTTERNUT;Haute Qualité Alimentaire;DEJEUNER
2020-12-10;Dessert;DESSERT FRUIT Po DE SAISON BIO ANNUEL 1;Produit Agriculture Biologique;DEJEUNER
2020-12-11;Légumes;EPINARDS BIO A LA VACHE QUI RIT;Produit Agriculture Biologique;DEJEUNER
2020-12-15;Plat;GRATIN POMME DE TERRE REBLOCHON - PLAT COMPLET ALTERNATIF PA;;DEJEUNER
2020-12-15;Légumes;HARICOTS VERTS BIO PERSILLES;Produit Agriculture Biologique;DEJEUNER
2020-12-15;Dessert;DESSERT FRUIT Po DE SAISON BIO ANNUEL 1;Produit Agriculture Biologique;DEJEUNER
2020-12-18;Légumes;POELEE RATATOUILLE GNOCCHI;;DEJEUNER
2020-12-18;Dessert;COMPOTE POMME/POIRE BIO/BISCUIT PETIT BEURRE;Produit Agriculture Biologique;DEJEUNER
2021-01-04;Fromage;FROMAGE CANTAL AOP;Haute Qualité Alimentaire;DEJEUNER
2021-01-05;Entrée;BETTERAVE DES AU MAIS;;DEJEUNER
2021-01-05;Plat;NUGGETS POISSON ET CITRON;;DEJEUNER
2021-01-05;Dessert;GLACE SUNDAE VANILLE/FRAISE;;DEJEUNER
2021-01-07;Plat;BOEUF BIO FACON GARDIANE;Produit Agriculture Biologique;DEJEUNER
2021-01-07;Légumes;RIZ DE CAMARGUE PILAF;Haute Qualité Alimentaire;DEJEUNER
2021-01-08;Plat;SAUCISSE AUX HERBES A GRILLER A/PORC HQA;Haute Qualité Alimentaire;DEJEUNER
2021-01-11;Fromage;FROMAGE EMMENTAL BIO IND;Produit Agriculture Biologique;DEJEUNER
2021-01-12;Entrée;SOUPE DE LEGUMES UPC;Haute Qualité Alimentaire;DEJEUNER
2021-01-14;Entrée;SAMOUSSA;;DEJEUNER
2021-01-14;Entrée;TAPENADE LEGUMES HIVER UPC;Haute Qualité Alimentaire;DEJEUNER
2021-01-14;Plat;ASSIETTE ORIENTALE ET SA SEMOULE BIO - COMPLET ALTERNATIF PV;;DEJEUNER
2021-01-15;Plat;ESCALOPE POULET BBC A GRILLER SAUCE FORESTIERE;;DEJEUNER
2021-01-15;Plat;NAVARIN DE MOUTON PROVENCAL;Haute Qualité Alimentaire;DEJEUNER
2021-01-15;Fromage;FROMAGE PETIT LOUIS COQUE IND;;DEJEUNER
2021-01-15;Dessert;LIEGEOIS BIO SAVEUR CHOCOLAT IND;Produit Agriculture Biologique;DEJEUNER
2021-01-18;Dessert;DESSERT FRUIT Po DE SAISON BIO ANNUEL 2;Produit Agriculture Biologique;DEJEUNER
2021-01-19;Entrée;NEMS SUR SALADE;;DEJEUNER
2021-01-19;Entrée;SOUPE A L'OIGNON FRAIS MAISON;Haute Qualité Alimentaire;DEJEUNER
2021-01-19;Fromage;FROMAGE BLANC AU SUCRE;;DEJEUNER
2021-01-19;Dessert;COMPOTE POMME FRAICHE UPC;Haute Qualité Alimentaire;DEJEUNER
2021-01-21;Entrée;FILET DE MAQUEREAU ESCABECHE;;DEJEUNER
2021-01-21;Plat;DOS DE COLIN MARINADE HUILE D'OLIVE ET CITRON;;DEJEUNER
2021-01-22;Entrée;SALADE MELANGE LOCALE BIO NICOISE;Produit Agriculture Biologique;DEJEUNER
2021-01-25;Entrée;OEUF A LA COQUE ET MOUILLETTE;;DEJEUNER
2021-01-25;Légumes;CAROTTE BIO A LA CREME;Produit Agriculture Biologique;DEJEUNER
2021-01-25;Dessert;DESSERT FRUIT Po DE SAISON BIO ANNUEL 1;Produit Agriculture Biologique;DEJEUNER
2021-01-26;Fromage;FROMAGE CAMEMBERT BIO;Produit Agriculture Biologique;DEJEUNER
2021-01-26;Fromage;YAOURT BIO SUCRE SAVEUR VANILLE;Produit Agriculture Biologique;DEJEUNER
2021-01-28;Entrée;VELOUTE CAROTTES BIO MAISON;Produit Agriculture Biologique;DEJEUNER
2021-01-28;Légumes;POELEE LEGUMES TAJINE;;DEJEUNER
2021-01-28;Légumes;QUINOA BIO;Produit Agriculture Biologique;DEJEUNER
2021-01-28;Fromage;PETITS SUISSE BIO AUX FRUITS;Produit Agriculture Biologique;DEJEUNER
2021-01-28;Dessert;SALADE FRUITS D'HIVER FRAIS;Haute Qualité Alimentaire;DEJEUNER
2021-01-29;Entrée;SALADE MELANGE LOCALE BIO BILLES MOZZARELLA;Produit Agriculture Biologique;DEJEUNER
2021-01-29;Plat;STEAK HACHE DE BOEUF FACON BOUCHERE;;DEJEUNER
2021-01-29;Dessert;CREME DESSERT CHOCOLAT BIO;Produit Agriculture Biologique;DEJEUNER
2021-02-01;Légumes;POELEE RATATOUILLE;;DEJEUNER
2021-02-02;Plat;CREPE JAMBON/LARDONS UPC;;DEJEUNER
2021-02-02;Fromage;YAOURT NATURE BIO LAIT ENTIER ET SUCRE;Produit Agriculture Biologique;DEJEUNER
2021-02-02;Dessert;CREPE PATE A TARTINER;;DEJEUNER
2021-02-04;Entrée;SALADE MELANGE LOCALE BIO MIMOSA;Produit Agriculture Biologique;DEJEUNER
2020-09-01;Plat;ESCALOPE DE PORC A GRILLER AUX HERBES DE PROVENCE;Haute Qualité Alimentaire;DEJEUNER
2021-02-05;Plat;ESCALOPE DE POULET PANE;;DEJEUNER
2020-09-01;Fromage;FROMAGE CAMEMBERT BIO;Produit Agriculture Biologique;DEJEUNER
2021-02-05;Fromage;FROMAGE KIRI CREME IND;;DEJEUNER
2020-09-01;Dessert;MOUSSE AU CHOCOLAT AU LAIT IND;;DEJEUNER
2021-02-09;Dessert;DESSERT FRUIT Po DE SAISON BIO ANNUEL 1;Produit Agriculture Biologique;DEJEUNER
2020-09-04;Fromage;YAOURT BIO SUCRE SAVEUR VANILLE;Produit Agriculture Biologique;DEJEUNER
2021-02-12;Entrée;LENTILLES VINAIGRETTE;;DEJEUNER
2020-09-04;Dessert;GLACE SUNDAE CHOCOLAT;;DEJEUNER
2021-02-12;Légumes;HARICOTS VERTS BIO AU BEURRE PERSILLES;Produit Agriculture Biologique;DEJEUNER
2020-09-08;Entrée;MELON PAYS;Haute Qualité Alimentaire;DEJEUNER
2021-02-12;Fromage;FROMAGE GOUDA BIO IND;Produit Agriculture Biologique;DEJEUNER
2020-09-08;Entrée;SALADE GRECQUE UPC;Haute Qualité Alimentaire;DEJEUNER
2021-02-12;Dessert;CREME DESSERT VANILLE BIO;Produit Agriculture Biologique;DEJEUNER
2020-09-08;Plat;FAJITAS VEGE - PLAT COMPLET ALTERNATIF PV;;DEJEUNER
2021-03-01;Plat;FILET MEUNIERE ET CITRON;;DEJEUNER
2020-09-08;Plat;PORC ESCALOPE BIO SAUCE MOUTARDE A L'ANCIENNE;Haute Qualité Alimentaire;DEJEUNER
2021-03-01;Légumes;POMME DE TERRE NOISETTE;;DEJEUNER
2020-09-10;Entrée;GASPACHO;;DEJEUNER
2021-03-02;Entrée;AVOCAT MAYONNAISE;;DEJEUNER
2020-09-14;Entrée;CONCOMBRE FRAIS VINAIGRETTE;Haute Qualité Alimentaire;DEJEUNER
2021-03-02;Fromage;FROMAGE BLANC NATURE BIO;Produit Agriculture Biologique;DEJEUNER
2020-09-14;Plat;HAUT DE CUISSE/PILONS DE POULET ROTI BIO;Produit Agriculture Biologique;DEJEUNER
2021-03-02;Dessert;DESSERT FRUIT Po DE SAISON BIO ANNUEL 2;Produit Agriculture Biologique;DEJEUNER
2020-09-14;Fromage;FROMAGE PELARDON;Haute Qualité Alimentaire;DEJEUNER
2021-03-04;Plat;ESCALOPE DE PORC BIO SAUCE CATALANE;Produit Agriculture Biologique;DEJEUNER
2020-09-15;Entrée;JAMBON CRU SALVETAT/CORNICHON A/PORC;Haute Qualité Alimentaire;DEJEUNER
2021-03-04;Fromage;FROMAGE CARRE FRAIS BIO IND;Produit Agriculture Biologique;DEJEUNER
2020-09-15;Entrée;TOMATE MACEDOINE;;DEJEUNER
2021-03-04;Dessert;RIZ AU LAIT ENTIER ET CARAMEL IND;;DEJEUNER
2020-09-15;Plat;DOS DE CABILLAUD SAUCE COCKTAIL;;DEJEUNER
2021-03-05;Plat;SAUTE DE VEAU BIO TANDOORI;Produit Agriculture Biologique;DEJEUNER
2020-09-17;Entrée;TOMATE CERISE TAPENADE;;DEJEUNER
2021-03-11;Entrée;MORTADELLE IGP A/PORC;Haute Qualité Alimentaire;DEJEUNER
2020-09-17;Plat;PAELLA AU POULET - PLAT COMPLET;;DEJEUNER
2021-03-12;Plat;PAVE DE SAUMON A L'HUILE D'OLIVE;;DEJEUNER
2020-09-17;Fromage;FROMAGE EMMENTAL BIO IND;Produit Agriculture Biologique;DEJEUNER
2021-03-12;Dessert;ANANAS FRAIS EN TRANCHE;Haute Qualité Alimentaire;DEJEUNER
2020-09-18;Entrée;CAKE AUX OLIVES. DES DE BREBIS ET SALADE MELANGE;Haute Qualité Alimentaire;DEJEUNER
2021-03-15;Entrée;POMELOS BIO AU SUCRE (ENTREE);Produit Agriculture Biologique;DEJEUNER
2020-09-18;Entrée;SALADE MELANGE BIO AUX OIGNONS FRITS;Produit Agriculture Biologique;DEJEUNER
2021-03-15;Légumes;POMME DE TERRE ALLUMETTE FRITE;;DEJEUNER
2020-09-18;Entrée;TOMATE FRAICHE VINAIGRETTE;Haute Qualité Alimentaire;DEJEUNER
2021-03-16;Entrée;RADIS BEURRE;Haute Qualité Alimentaire;DEJEUNER
2020-09-18;Légumes;POELEE RIZ A LA CAMARGUAISE;;DEJEUNER
2021-03-16;Fromage;FROMAGE CAMEMBERT BIO;Produit Agriculture Biologique;DEJEUNER
2020-09-24;Plat;FAJITAS MEXICAINES - PLAT COMPLET;;DEJEUNER
2021-03-16;Fromage;YAOURT BIO SUCRE SAVEUR VANILLE;Produit Agriculture Biologique;DEJEUNER
2020-09-24;Plat;OMELETTE NATURE BIO;Produit Agriculture Biologique;DEJEUNER
2021-03-18;Entrée;SALADE STRASBOURGEOISE;;DEJEUNER
2020-09-25;Entrée;MELON PAYS AU JAMBON;;DEJEUNER
2021-03-18;Légumes;CAROTTES BIO A LA PAYSANNE UPC;Produit Agriculture Biologique;DEJEUNER
2020-09-25;Dessert;DESSERT FRUIT Po DE SAISON BIO ANNUEL 2;Produit Agriculture Biologique;DEJEUNER
2021-03-18;Légumes;POELEE DE SAISON;Haute Qualité Alimentaire;DEJEUNER
2020-09-28;Entrée;POMELOS BIO AU SUCRE (ENTREE);Produit Agriculture Biologique;DEJEUNER
2021-03-18;Fromage;FROMAGE BRIE BIO COUPE;Produit Agriculture Biologique;DEJEUNER
2020-09-28;Dessert;GLACE CONE VANILLE;;DEJEUNER
2021-03-18;Fromage;YAOURT BIO LOCAL EN SEAU;Produit Agriculture Biologique;DEJEUNER
2020-09-29;Entrée;CONCOMBRE FRAIS SAUCE RAITA;Haute Qualité Alimentaire;DEJEUNER
2021-03-18;Dessert;MOUSSE AU CHOCOLAT AU LAIT IND;;DEJEUNER
2020-10-01;Entrée;SALADE MELANGE BIO LOCALE  AU THON;Produit Agriculture Biologique;DEJEUNER
2021-03-19;Entrée;SALADE MACHE EMMENTAL;Haute Qualité Alimentaire;DEJEUNER
2020-10-01;Légumes;PETIT POIS BIO PAYSANNE A/PORC;Produit Agriculture Biologique;DEJEUNER
2021-03-22;Entrée;FEUILLETE HOT DOG VOLAILLE;;DEJEUNER
2020-10-02;Fromage;YAOURT A BOIRE PANACHE;;DEJEUNER
2021-03-22;Entrée;OEUF A LA COQUE ET MOUILLETTE;;DEJEUNER
2020-10-02;Dessert;PARIS BREST;;DEJEUNER
2021-03-22;Dessert;DESSERT FRUIT Po DE SAISON BIO ANNUEL 2;Produit Agriculture Biologique;DEJEUNER
2020-10-05;Entrée;RADIS BEURRE;Haute Qualité Alimentaire;DEJEUNER
2021-03-23;Légumes;POELEE LEGUMES TAJINE;;DEJEUNER
2020-10-08;Entrée;SALADE MELANGE BIO AVEYRONNAISE;Produit Agriculture Biologique;DEJEUNER
2021-03-25;Entrée;SALADE COLESLAW UPC;Haute Qualité Alimentaire;DEJEUNER
2020-10-08;Plat;TIELLE  PLAT COMPLET;Haute Qualité Alimentaire;DEJEUNER
2021-03-26;Plat;DOS DE COLIN SAUCE SETOISE;;DEJEUNER
2020-10-08;Dessert;FROMAGE BLANC CEVENOL BIO;;DEJEUNER
2021-03-26;Légumes;POMMES VAPEUR PERSILLEES;;DEJEUNER
2020-10-09;Plat;PARMENTIER PATATE DOUCE/LENTILLES (COLLEGE) - COMPLET ALTERNATIF PV;;DEJEUNER
2021-03-26;Dessert;KIWI;;DEJEUNER
2020-10-09;Fromage;YAOURT NATURE BIO LES 2 VACHES ET SUCRE;Produit Agriculture Biologique;DEJEUNER
2021-03-29;Entrée;HOUMOUS ET BATONNET CAROTTE UPC;Haute Qualité Alimentaire;DEJEUNER
2020-10-12;Entrée;CAROTTES RAPEES BIO AU CITRON ET HUILE D'OLIVE;;DEJEUNER
2021-03-29;Entrée;SALADE COEUR DE BLE AU THON;;DEJEUNER
2020-10-12;Dessert;BEIGNET POMME;;DEJEUNER
2021-03-29;Fromage;FROMAGE CARRE FRAIS BIO IND;Produit Agriculture Biologique;DEJEUNER
2020-10-13;Entrée;AVOCAT AU CREVETTE;;DEJEUNER
2021-03-29;Dessert;BEIGNET DONUT'S DOONYS;;DEJEUNER
2020-10-13;Fromage;FROMAGE PORT SALUT;;DEJEUNER
2021-03-30;Plat;CHILI VEGE PLAT COMPLET ALTERNATIF PV;;DEJEUNER
2020-10-15;Entrée;PATE CAMPAGNE HQA A/PORC;Haute Qualité Alimentaire;DEJEUNER
2021-03-30;Légumes;HARICOTS VERTS BIO PERSILLES;Produit Agriculture Biologique;DEJEUNER
2020-10-15;Entrée;TIELLE DE SETE IND;;DEJEUNER
2020-09-01;Entrée;CAROTTES RAPEES BIO;Produit Agriculture Biologique;DEJEUNER
2021-03-30;Fromage;FROMAGE EMMENTAL BIO A LA COUPE;Produit Agriculture Biologique;DEJEUNER
2020-10-15;Légumes;POELEE MEDITERRANEENNE AUX LEGUMES GRILLES;;DEJEUNER
2020-09-01;Dessert;LIEGEOIS VANILLE / CARAMEL;;DEJEUNER
2021-04-01;Entrée;BETTERAVE DES AU MAIS;;DEJEUNER
2020-10-15;Fromage;FROMAGE TOMME CATALANE AOP;Haute Qualité Alimentaire;DEJEUNER
2020-09-03;Fromage;FROMAGE PETIT LOUIS COQUE IND;;DEJEUNER
2021-04-01;Légumes;PETIT POIS CAROTTES BIO UPC;Produit Agriculture Biologique;DEJEUNER
2020-10-16;Entrée;POMELOS BIO AU SUCRE (ENTREE);Produit Agriculture Biologique;DEJEUNER
2020-09-04;Entrée;SALADE POMME DE TERRE AU THON UPC;;DEJEUNER
2021-04-01;Fromage;FROMAGE BRIE BIO COUPE;Produit Agriculture Biologique;DEJEUNER
2020-10-16;Fromage;FROMAGE PIK ET CROQ IND;;DEJEUNER
2020-09-04;Légumes;RATATOUILLE UPC;;DEJEUNER
2021-04-02;Entrée;SALADE LAITUE FEUILLE BIO AU CHEVRE CHAUD;Produit Agriculture Biologique;DEJEUNER
2020-11-02;Entrée;FILET DE MAQUEREAU MOUTARDE;;DEJEUNER
2020-09-04;Fromage;YAOURT FERMIER HQA ET SUCRE;Haute Qualité Alimentaire;DEJEUNER
2021-04-02;Plat;FILET DE COLIN PANE AVEC CITRON;;DEJEUNER
2020-11-02;Légumes;GALETTE POMME DE TERRE RAPEE;;DEJEUNER
2020-09-07;Dessert;DESSERT FRUIT Po DE SAISON BIO ANNUEL 1;Produit Agriculture Biologique;DEJEUNER
2021-04-06;Entrée;SALADE MELANGE BIO AVEYRONNAISE;Produit Agriculture Biologique;DEJEUNER
2020-11-02;Fromage;FROMAGE SAINT PAULIN BIO;Produit Agriculture Biologique;DEJEUNER
2020-09-08;Entrée;JAMBON CUIT / BEURRE;;DEJEUNER
2021-04-06;Légumes;POMMES VAPEUR PERSILLEES;;DEJEUNER
2020-11-03;Dessert;POIRE WILLIAMS BIO AU MIEL ET AMANDES GRILLEES;Produit Agriculture Biologique;DEJEUNER
2020-09-08;Légumes;POMME DE TERRE ALLUMETTE FRITE;;DEJEUNER
2021-04-06;Dessert;FROMAGE BLANC CEVENOL ET CREME DE MARRON;;DEJEUNER
2020-11-05;Dessert;DESSERT FRUIT Po DE SAISON BIO ANNUEL 2;Produit Agriculture Biologique;DEJEUNER
2020-09-08;Fromage;FROMAGE SALAGOU BREBIS/VACHE;Haute Qualité Alimentaire;DEJEUNER
2021-04-08;Légumes;QUINOA BIO;Produit Agriculture Biologique;DEJEUNER
2020-11-06;Légumes;GRATIN DAUPHINOIS UPC;;DEJEUNER
2020-09-10;Entrée;MAIS AU THON;;DEJEUNER
2021-04-08;Dessert;DESSERT FRUIT Po DE SAISON BIO ANNUEL 2;Produit Agriculture Biologique;DEJEUNER
2020-11-06;Fromage;FROMAGE EDAM BIO IND;Produit Agriculture Biologique;DEJEUNER
2020-09-10;Fromage;YAOURT NATURE BIO 1/2 ECREME ET SUCRE;Produit Agriculture Biologique;DEJEUNER
2021-04-09;Entrée;SALADE MELANGE LOCALE BIO AU MAIS;Produit Agriculture Biologique;DEJEUNER
2020-11-06;Dessert;GATEAU DE SEMOULE IND;;DEJEUNER
2020-09-11;Entrée;OEUF A LA COQUE ET MOUILLETTE;;DEJEUNER
2021-04-09;Fromage;FROMAGE EDAM BIO IND;Produit Agriculture Biologique;DEJEUNER
2020-11-10;Légumes;PUREE DE BUTTERNUT;Haute Qualité Alimentaire;DEJEUNER
2020-09-11;Plat;POISSON PAVE BORDELAISE;;DEJEUNER
2021-04-09;Dessert;GLACE BARRE SNICKERS;;DEJEUNER
2020-11-12;Entrée;SALADE DE MACHE AUX BETTERAVES BIO;Produit Agriculture Biologique;DEJEUNER
2020-09-11;Dessert;RAISIN DE PAYS;Haute Qualité Alimentaire;DEJEUNER
2021-04-12;Entrée;MORTADELLE IGP A/PORC;Haute Qualité Alimentaire;DEJEUNER
2020-11-12;Fromage;YAOURT CITRON BIO;Produit Agriculture Biologique;DEJEUNER
2020-09-14;Légumes;RIZ DE CAMARGUE PILAF;Haute Qualité Alimentaire;DEJEUNER
2021-04-12;Dessert;DESSERT FRUIT Po DE SAISON BIO ANNUEL 1;Produit Agriculture Biologique;DEJEUNER
2020-11-16;Dessert;ILE FLOTTANTE ET CREME ANGLAISE;;DEJEUNER
2020-09-14;Dessert;DESSERT FRUIT Po DE SAISON BIO ANNUEL 1;Produit Agriculture Biologique;DEJEUNER
2021-04-13;Entrée;TOMATE SAUCE BASILIC/CITRON;;DEJEUNER
2020-11-17;Entrée;SALADE TENDRESSE AUX LARDONS;Haute Qualité Alimentaire;DEJEUNER
2020-09-14;Dessert;DESSERT FRUIT Po DE SAISON BIO ANNUEL 2;Produit Agriculture Biologique;DEJEUNER
2021-04-13;Fromage;FROMAGE SAINT PAULIN BIO;Produit Agriculture Biologique;DEJEUNER
2020-11-17;Fromage;YAOURT FRAISE AU LAIT ENTIER BIO IND;Produit Agriculture Biologique;DEJEUNER
2020-09-15;Entrée;MELON PAYS;Haute Qualité Alimentaire;DEJEUNER
2021-04-13;Dessert;GATEAU AUX POIRES UPC;;DEJEUNER
2020-11-19;Entrée;PIZZA FRAICHE AU FROMAGE MOZZARELLA;;DEJEUNER
2020-09-17;Entrée;CAROTTES RAPEES BIO;Produit Agriculture Biologique;DEJEUNER
2021-04-15;Entrée;SALADE MELANGE BIO AU LEERDAMER ZIG-ZAG;Produit Agriculture Biologique;DEJEUNER
2020-11-19;Légumes;PUREE DE POMME DE TERRE UPC;;DEJEUNER
2020-09-17;Entrée;SALADE MELANGEE BIO A LA FOURME D'AMBERT;Produit Agriculture Biologique;DEJEUNER
2021-04-15;Fromage;FROMAGE GOUDA BIO IND;Produit Agriculture Biologique;DEJEUNER
2020-11-20;Légumes;PUREE DE PATATE DOUCE;;DEJEUNER
2020-09-17;Fromage;FROMAGE BLANC NATURE BIO;Produit Agriculture Biologique;DEJEUNER
2021-04-16;Entrée;GASPACHO;;DEJEUNER
2020-11-20;Légumes;RIZ PILAF;;DEJEUNER
2020-09-21;Dessert;DESSERT FRUIT Po DE SAISON BIO ANNUEL 1;Produit Agriculture Biologique;DEJEUNER
2021-04-16;Entrée;PIZZA AU FROMAGE EN BANDE;;DEJEUNER
2020-11-20;Fromage;YAOURT BIO SUCRE SAVEUR VANILLE;Produit Agriculture Biologique;DEJEUNER
2020-09-22;Plat;SAUTE DE DINDE BIO MARENGO;Produit Agriculture Biologique;DEJEUNER
2021-04-16;Entrée;SALADE LAITUE BIO AUX CROUTONS;Produit Agriculture Biologique;DEJEUNER
2020-11-20;Dessert;GATEAU CHOCO-COCO;;DEJEUNER
2020-09-22;Fromage;FROMAGE BLANC NATURE BIO;Produit Agriculture Biologique;DEJEUNER
2021-04-16;Plat;SAUMON A LA CREME;;DEJEUNER
2020-11-23;Entrée;JAMBON CRU SALVETAT/CORNICHON A/PORC;Haute Qualité Alimentaire;DEJEUNER
2020-09-22;Fromage;YAOURT VELOUTE AUX FRUITS MIXES;;DEJEUNER
2021-05-03;Entrée;POMELOS BIO AU SUCRE (ENTREE);Produit Agriculture Biologique;DEJEUNER
2020-11-23;Plat;BOEUF BIO ESTOUFFADE PROVENCALE;Produit Agriculture Biologique;DEJEUNER
2020-09-25;Entrée;SALADE MELANGE LOCALE BIO MIMOSA;Produit Agriculture Biologique;DEJEUNER
2021-05-03;Légumes;FRITES DE  LEGUMES;;DEJEUNER
2020-11-24;Légumes;POELEE RIZ A LA CAMARGUAISE;;DEJEUNER
2020-09-25;Plat;BOEUF BIO FACON GARDIANE;Produit Agriculture Biologique;DEJEUNER
2021-05-03;Fromage;YAOURT NATURE BIO LAIT ENTIER ET SUCRE;Produit Agriculture Biologique;DEJEUNER
2020-11-26;Entrée;SALADE TENDRESSE AU MAIS;Haute Qualité Alimentaire;DEJEUNER
2020-09-25;Plat;MOULES SAUCE MARINIERE A LA CREME;;DEJEUNER
2021-05-04;Plat;SAUCISSE AUX HERBES A GRILLER A/PORC HQA;Haute Qualité Alimentaire;DEJEUNER
2020-11-27;Légumes;POMMES VAPEUR PERSILLEES;;DEJEUNER
2020-09-25;Légumes;PATE MACARONIS BIO AU BEURRE;Produit Agriculture Biologique;DEJEUNER
2021-05-06;Entrée;SALADE LAITUE BIO AUX NOISETTES;Produit Agriculture Biologique;DEJEUNER
2020-11-27;Fromage;YAOURT A BOIRE PANACHE;;DEJEUNER
2020-09-25;Légumes;POMME DE TERRE ALLUMETTE FRITE;;DEJEUNER
2021-05-07;Légumes;CAROTTES FRAICHES SAUTEES UPC;Haute Qualité Alimentaire;DEJEUNER
2020-11-30;Entrée;CHOU CHINOIS VINAIGRETTE SOJA;;DEJEUNER
2020-09-25;Légumes;POMME DE TERRE FRITE FRAICHE;;DEJEUNER
2021-05-07;Dessert;CREME DESSERT CHOCOLAT BIO;Produit Agriculture Biologique;DEJEUNER
2020-11-30;Légumes;COURGETTES FACON THAI;Haute Qualité Alimentaire;DEJEUNER
2020-09-28;Légumes;CAROTTE BIO BEURRE PERSILLEE;Produit Agriculture Biologique;DEJEUNER
2021-05-10;Légumes;PUREE DE CAROTTES UPC;;DEJEUNER
2020-12-01;Plat;FILET DE COLIN PANE AVEC CITRON;;DEJEUNER
2020-09-28;Légumes;POMME SAUTEE;;DEJEUNER
2021-05-10;Dessert;DESSERT FRUIT Po DE SAISON BIO ANNUEL 1;Produit Agriculture Biologique;DEJEUNER
2020-12-03;Plat;CHIPOLATA A GRILLER;Haute Qualité Alimentaire;DEJEUNER
2020-09-28;Fromage;FROMAGE MINI BABYBEL IND;;DEJEUNER
2021-05-18;Légumes;GRATIN DAUPHINOIS;;DEJEUNER
2020-12-03;Plat;GRATIN SEMOULE AUX LEGUMES ET PARMESAN - COMPLET ALTERNATIF PA;;DEJEUNER
